{
  "schemaVersion": 1,
  "corpusId": "computer-use-v8-platform-lab-2026-07",
  "description": "Public v8 reliability matrix. Live-only rows require an interactive OS session or hardware runner and cannot be satisfied by deterministic simulation.",
  "scenarios": [
    { "id": "deterministic-display-transform", "title": "Logical/physical display transform boundaries", "platforms": ["darwin", "win32", "linux"], "approaches": ["runtime"], "category": "display", "condition": "seeded positive and negative display origins with scale factors 1, 1.25, 1.5, 2", "minimumEvidence": "deterministic", "assertions": ["coordinates.round_trip", "coordinates.bounds_fail_closed"], "requiredFacts": ["cases", "scaleFactors"] },
    { "id": "deterministic-interference-guard", "title": "Focus and modal drift fail closed", "platforms": ["darwin", "win32", "linux"], "approaches": ["runtime"], "category": "interference", "condition": "seeded focus thief, overlay, notification, and modal target revisions", "minimumEvidence": "deterministic", "assertions": ["target.drift_blocked", "mutation.zero_after_drift"], "requiredFacts": ["faults", "seed"] },
    { "id": "deterministic-emergency-latch", "title": "Emergency stop latches across calls", "platforms": ["darwin", "win32", "linux"], "approaches": ["runtime"], "category": "interference", "condition": "stop during an active lease followed by queued and fresh acquisition attempts", "minimumEvidence": "deterministic", "assertions": ["lease.active_revoked", "lease.new_work_blocked", "reset.host_only"], "requiredFacts": ["revokedLeases", "blockedAcquisitions"] },
    { "id": "physical-emergency-chord", "title": "Out-of-band physical emergency chord", "platforms": ["darwin", "win32"], "approaches": ["physical_input"], "category": "interference", "condition": "interactive hardware keyboard chord while a native input loop is active and the MCP client is disconnected", "minimumEvidence": "live", "assertions": ["chord.physical_only", "native_loop.interrupted", "mutation.zero_after_latch", "reconnect.still_latched"], "requiredFacts": ["chord", "latencyMs", "postLatchMutationAttempts", "disconnectObserved"] },
    { "id": "multi-monitor-mixed-scale", "title": "Multi-monitor and mixed scaling", "platforms": ["darwin", "win32", "linux"], "approaches": ["capture", "physical_input"], "category": "display", "condition": "two or more attached displays with different scale factors and at least one non-zero origin", "minimumEvidence": "live", "assertions": ["capture.geometry_correct", "input.target_correct", "pointer.restored"], "requiredFacts": ["displayCount", "scaleFactors", "displayOrigins"] },
    { "id": "macos-retina", "title": "macOS Retina logical/pixel mapping", "platforms": ["darwin"], "approaches": ["capture", "physical_input"], "category": "display", "condition": "interactive Retina display", "minimumEvidence": "live", "assertions": ["capture.retina_correct", "input.logical_coordinates_correct"], "requiredFacts": ["scaleFactor", "pixelSize", "logicalSize"] },
    { "id": "windows-uac-integrity", "title": "Windows integrity and UAC boundary", "platforms": ["win32"], "approaches": ["uia", "physical_input"], "category": "privilege", "condition": "medium-integrity agent targeting elevated window and secure-desktop prompt", "minimumEvidence": "live", "assertions": ["elevation.no_bypass", "secure_desktop.fail_closed", "diagnostic.typed"], "requiredFacts": ["agentIntegrity", "targetIntegrity", "secureDesktopObserved"] },
    { "id": "remote-desktop-session", "title": "Remote desktop attach/detach", "platforms": ["darwin", "win32", "linux"], "approaches": ["capture", "physical_input"], "category": "session", "condition": "interactive remote session attach, disconnect, and reconnect", "minimumEvidence": "live", "assertions": ["disconnect.revokes_control", "reconnect.requires_revalidation", "mutation.zero_while_disconnected"], "requiredFacts": ["remoteProtocol", "disconnects", "reconnects"] },
    { "id": "lock-unlock-session", "title": "Host lock and unlock", "platforms": ["darwin", "win32", "linux"], "approaches": ["runtime"], "category": "session", "condition": "interactive lock followed by unlock", "minimumEvidence": "live", "assertions": ["lock.revokes_control", "unlock.requires_revalidation", "mutation.zero_while_locked"], "requiredFacts": ["lockTransitions", "unlockTransitions"] },
    { "id": "sleep-wake-session", "title": "Sleep and wake lifecycle", "platforms": ["darwin", "win32", "linux"], "approaches": ["runtime"], "category": "session", "condition": "host sleep/suspend followed by wake/resume", "minimumEvidence": "live", "assertions": ["sleep.revokes_control", "wake.requires_revalidation", "receipt.no_duplicate"], "requiredFacts": ["sleepTransitions", "wakeTransitions"] },
    { "id": "virtual-machine-session", "title": "Virtual machine display/session changes", "platforms": ["darwin", "win32", "linux"], "approaches": ["capture", "physical_input"], "category": "session", "condition": "interactive VM with dynamic display resize", "minimumEvidence": "live", "assertions": ["resize.invalidates_evidence", "input.new_geometry_correct"], "requiredFacts": ["hypervisor", "resizes"] },
    { "id": "macos-spaces-fullscreen-stage-manager", "title": "macOS Spaces, full-screen, and Stage Manager", "platforms": ["darwin"], "approaches": ["ax", "physical_input"], "category": "workspace", "condition": "switch Spaces, enter full-screen, and enable Stage Manager", "minimumEvidence": "live", "assertions": ["workspace.target_bound", "hidden_window.fail_closed", "user_workspace.restored"], "requiredFacts": ["spaceTransitions", "fullscreenTransitions", "stageManagerEnabled"] },
    { "id": "linux-x11", "title": "Linux X11 desktop", "platforms": ["linux"], "approaches": ["capture", "physical_input"], "category": "compositor", "condition": "interactive X11 session", "minimumEvidence": "live", "assertions": ["capture.supported", "input.attributed", "focus.diagnostic"], "requiredFacts": ["desktopEnvironment", "displayServer"] },
    { "id": "linux-wayland-gnome", "title": "GNOME Wayland and XDG portals", "platforms": ["linux"], "approaches": ["capture", "physical_input"], "category": "compositor", "condition": "interactive GNOME Wayland session with portal version recorded", "minimumEvidence": "live", "assertions": ["portal.capability_truthful", "unsupported_input.fail_closed", "capture.consent_respected"], "requiredFacts": ["compositorVersion", "portalVersion", "inputBackend"] },
    { "id": "linux-wayland-kde", "title": "KDE Plasma Wayland and XDG portals", "platforms": ["linux"], "approaches": ["capture", "physical_input"], "category": "compositor", "condition": "interactive KDE Plasma Wayland session with portal version recorded", "minimumEvidence": "live", "assertions": ["portal.capability_truthful", "unsupported_input.fail_closed", "capture.consent_respected"], "requiredFacts": ["compositorVersion", "portalVersion", "inputBackend"] },
    { "id": "linux-wayland-wlroots", "title": "wlroots Wayland compositor", "platforms": ["linux"], "approaches": ["capture", "physical_input"], "category": "compositor", "condition": "interactive wlroots session with compositor and portal implementation recorded", "minimumEvidence": "live", "assertions": ["portal.capability_truthful", "unsupported_input.fail_closed", "capture.consent_respected"], "requiredFacts": ["compositorName", "compositorVersion", "portalImplementation"] },
    { "id": "focus-notification-overlay-modal", "title": "Focus thieves, notifications, overlays, and modal dialogs", "platforms": ["darwin", "win32", "linux"], "approaches": ["ax", "uia", "physical_input"], "category": "interference", "condition": "interactive target with injected focus thief, notification, overlay, and modal interruption", "minimumEvidence": "live", "assertions": ["focus_loss.detected", "target.revalidated", "unintended_mutation.zero"], "requiredFacts": ["focusThefts", "notifications", "overlays", "modals"] }
  ],
  "corpusDigest": "sha256:7908782491bfeacc50af1338d6e26296b08441d3b4329aafdbbaa082c1466964"
}
